{
  "$schema": "../effect.schema.json",
  "version": 1,
  "effectId": "basic-sword-impact",
  "displayName": "Basic Sword impact",
  "mirrorLeftFromRight": true,
  "directions": {
    "right": {
      "version": 2,
      "durationSeconds": 1,
      "framesPerSecond": 1,
      "loop": false,
      "loopMode": "wrap",
      "layers": [
        {
          "layerId": "base",
          "displayName": "Basic sword",
          "assetId": "effect.weapon.hit-tiles",
          "depthOffset": 0,
          "transform": {
            "offset": [
              0,
              0
            ],
            "scale": [
              0.3,
              0.3
            ],
            "rotationDeg": 0,
            "flipX": false,
            "flipY": false,
            "origin": [
              0.5,
              0.5
            ]
          },
          "blocks": [
            {
              "from": 0,
              "through": 0,
              "sourceFrame": 0,
              "transform": {
                "offset": [
                  0,
                  0
                ],
                "scale": [
                  1,
                  1
                ],
                "rotationDeg": 0,
                "flipX": false,
                "flipY": false
              }
            }
          ]
        }
      ]
    },
    "up": {
      "version": 2,
      "durationSeconds": 1,
      "framesPerSecond": 12,
      "loop": false,
      "loopMode": "wrap",
      "layers": [
        {
          "layerId": "base",
          "displayName": "Basic sword",
          "assetId": "effect.weapon.hit-tiles",
          "depthOffset": 0,
          "transform": {
            "offset": [
              0,
              0
            ],
            "scale": [
              0.3,
              0.3
            ],
            "rotationDeg": 0,
            "flipX": false,
            "flipY": false,
            "origin": [
              0.5,
              0.5
            ]
          },
          "blocks": [
            {
              "from": 0,
              "through": 11,
              "sourceFrame": 0,
              "transform": {
                "offset": [
                  0,
                  0
                ],
                "scale": [
                  1,
                  1
                ],
                "rotationDeg": 0,
                "flipX": false,
                "flipY": false
              }
            }
          ]
        }
      ]
    },
    "down": {
      "version": 2,
      "durationSeconds": 1,
      "framesPerSecond": 12,
      "loop": false,
      "loopMode": "wrap",
      "layers": [
        {
          "layerId": "base",
          "displayName": "Basic sword",
          "assetId": "effect.weapon.hit-tiles",
          "depthOffset": 0,
          "transform": {
            "offset": [
              0,
              0
            ],
            "scale": [
              0.3,
              0.3
            ],
            "rotationDeg": 0,
            "flipX": false,
            "flipY": false,
            "origin": [
              0.5,
              0.5
            ]
          },
          "blocks": [
            {
              "from": 0,
              "through": 11,
              "sourceFrame": 0,
              "transform": {
                "offset": [
                  0,
                  0
                ],
                "scale": [
                  1,
                  1
                ],
                "rotationDeg": 0,
                "flipX": false,
                "flipY": false
              }
            }
          ]
        }
      ]
    }
  }
}
